{
  "schemaVersion": 1,
  "producedAt": "2026-09-06T19:29:00.797Z",
  "producer": {
    "name": "spec-ledger check",
    "version": "0.1.0"
  },
  "rows": [
    {
      "key": "command:82c028b6-b26e-82af-bb28-80b57bda6576",
      "runId": "11b81a74-2cd8-4219-a66c-c2f5ab906a92",
      "sourceDigest": "33c0154adae867718148d5db7540f8a190ee585ee7db06737d5c78c2a1e92e28",
      "checkDigest": "a3a66025dffbb860a60a469ba4539a84ddf2fdb7579acf7da15995813a15429e",
      "outcome": "pass",
      "detail": "exit 0",
      "durationMs": 268,
      "artifacts": [
        {
          "path": ".spec-ledger/evidence/check-runs/11b81a74-2cd8-4219-a66c-c2f5ab906a92-stdout.txt",
          "sha256": "9624d98a84837fb8a41add82b8baa46bebb71921cc9a868928df09df347dcedc",
          "required": true
        },
        {
          "path": ".spec-ledger/evidence/check-runs/11b81a74-2cd8-4219-a66c-c2f5ab906a92-stderr.txt",
          "sha256": "e3b0c44298fc1c149afbf4c8996fb92427ae41e4649b934ca495991b7852b855",
          "required": true
        }
      ]
    }
  ]
}
