{
  "schemaVersion": 1,
  "producedAt": "2026-09-07T05:33:59.658Z",
  "producer": {
    "name": "spec-ledger check",
    "version": "0.1.0"
  },
  "rows": [
    {
      "key": "command:a69fc4b7-ac59-8d37-954c-2e53efd1bda6",
      "runId": "908d849f-04d9-4090-920c-d4980bda839c",
      "sourceDigest": "bcc0a651ecc16888d55132f26b9dd2896949fcd57c3160946c574b822e25b0eb",
      "checkDigest": "dc815e196076edc0e455fabb9bddc735d28d1daa20808ab186600f907b460de0",
      "outcome": "pass",
      "detail": "exit 0",
      "durationMs": 195,
      "artifacts": [
        {
          "path": ".spec-ledger/evidence/check-runs/908d849f-04d9-4090-920c-d4980bda839c-stdout.txt",
          "sha256": "a53041fc73dd0e55572bc2f0660a312c379dc6f9da840caf4aca8eab04668772",
          "required": true
        },
        {
          "path": ".spec-ledger/evidence/check-runs/908d849f-04d9-4090-920c-d4980bda839c-stderr.txt",
          "sha256": "e3b0c44298fc1c149afbf4c8996fb92427ae41e4649b934ca495991b7852b855",
          "required": true
        }
      ]
    }
  ]
}
