{
  "schemaVersion": 1,
  "producedAt": "2026-09-06T07:29:50.930Z",
  "producer": {
    "name": "spec-ledger check",
    "version": "0.1.0"
  },
  "rows": [
    {
      "key": "command:dea7dcb9-9337-8e8a-9d0d-db2816e25612",
      "runId": "8cb20126-1f07-48a9-89c9-c883ee517852",
      "sourceDigest": "8ac1d48125ccee06b9671056a4b75a10d9bfc6b8cb4ac4f619b908109541e401",
      "checkDigest": "1aeee979a7bc0413f614034f48ff31590dc33735c14d4ffdca62837f76b7de0e",
      "outcome": "pass",
      "detail": "exit 0",
      "durationMs": 884,
      "artifacts": [
        {
          "path": ".spec-ledger/evidence/check-runs/8cb20126-1f07-48a9-89c9-c883ee517852-stdout.txt",
          "sha256": "e181088d116e7d9894a5cf74655c7adce484d904441a2af6ceb57078ac33d328",
          "required": true
        },
        {
          "path": ".spec-ledger/evidence/check-runs/8cb20126-1f07-48a9-89c9-c883ee517852-stderr.txt",
          "sha256": "e3b0c44298fc1c149afbf4c8996fb92427ae41e4649b934ca495991b7852b855",
          "required": true
        }
      ]
    }
  ]
}
