{
  "schemaVersion": 1,
  "producedAt": "2026-09-06T07:24:19.327Z",
  "producer": {
    "name": "spec-ledger check",
    "version": "0.1.0"
  },
  "rows": [
    {
      "key": "command:b-sl-033",
      "runId": "46f6fd57-20d1-4b94-899a-1cde669cf8e9",
      "sourceDigest": "5da35595ece444f4b6f1b69c56ed2c89b4583ea26e1b065be4f37c6e42f8395e",
      "checkDigest": "4a2b636b12cd3dc180613cddca369d7aed2c34416b5c666c55e793565d6993bf",
      "outcome": "pass",
      "detail": "exit 0",
      "durationMs": 274,
      "artifacts": [
        {
          "path": ".spec-ledger/evidence/check-runs/46f6fd57-20d1-4b94-899a-1cde669cf8e9-stdout.txt",
          "sha256": "b0f0993a30033244cf8bf287153d9329065fc247268f2bc7b18ecf57add62fca",
          "required": true
        },
        {
          "path": ".spec-ledger/evidence/check-runs/46f6fd57-20d1-4b94-899a-1cde669cf8e9-stderr.txt",
          "sha256": "e3b0c44298fc1c149afbf4c8996fb92427ae41e4649b934ca495991b7852b855",
          "required": true
        }
      ]
    }
  ]
}
