{
  "schemaVersion": 1,
  "producedAt": "2026-09-05T01:57:18.473Z",
  "producer": {
    "name": "spec-ledger check",
    "version": "0.1.0"
  },
  "rows": [
    {
      "key": "command:240c8922-405a-824b-a2d4-e8ecbb5be6bd",
      "runId": "05e8a3a2-fb19-4c05-a6d2-607f8377c9fe",
      "sourceDigest": "5159553a93564fdf32dd6f9559cb37eea28cba17d5fd53e66bdb4d5148776a40",
      "checkDigest": "39d2d51c602bf0bc78ab377446544b2019b8a06b7f9e7c67bde03b4bb8165ecc",
      "outcome": "pass",
      "detail": "exit 0"
    },
    {
      "key": "command:35c8eb44-8d25-8185-82c2-bf645f8f0710",
      "runId": "05e8a3a2-fb19-4c05-a6d2-607f8377c9fe",
      "sourceDigest": "5159553a93564fdf32dd6f9559cb37eea28cba17d5fd53e66bdb4d5148776a40",
      "checkDigest": "12a9c7671a3e0c7ce75c223d23595028c279d3c60cfa2c045728bca1810f14cc",
      "outcome": "pass",
      "detail": "exit 0"
    },
    {
      "key": "command:bc2c8e56-0cda-8b8a-a9a0-bafe5989265f",
      "runId": "05e8a3a2-fb19-4c05-a6d2-607f8377c9fe",
      "sourceDigest": "5159553a93564fdf32dd6f9559cb37eea28cba17d5fd53e66bdb4d5148776a40",
      "checkDigest": "5bcda63f17a5d271649b337f3a0c4595acaf6e490035caedc302680dc3ac06d6",
      "outcome": "pass",
      "detail": "exit 0"
    },
    {
      "key": "command:c4ff7e22-ebc9-8d3f-a34e-a21d102a83c8",
      "runId": "05e8a3a2-fb19-4c05-a6d2-607f8377c9fe",
      "sourceDigest": "5159553a93564fdf32dd6f9559cb37eea28cba17d5fd53e66bdb4d5148776a40",
      "checkDigest": "a88a483a1daeb8b0b06051f1835ce6a7db1c5d3dcd010f252cc0e75ef3ce419b",
      "outcome": "pass",
      "detail": "exit 0"
    },
    {
      "key": "command:37455091-6c3b-827f-8ed3-f4737345e01c",
      "runId": "05e8a3a2-fb19-4c05-a6d2-607f8377c9fe",
      "sourceDigest": "5159553a93564fdf32dd6f9559cb37eea28cba17d5fd53e66bdb4d5148776a40",
      "checkDigest": "95cce2053d6132c6ad17dd9547e82afdfd0554e7405c5ee6e1935f1a56a39813",
      "outcome": "pass",
      "detail": "exit 0"
    },
    {
      "key": "command:0e24eba8-4721-8373-ba7d-0f18be5063fc",
      "runId": "05e8a3a2-fb19-4c05-a6d2-607f8377c9fe",
      "sourceDigest": "5159553a93564fdf32dd6f9559cb37eea28cba17d5fd53e66bdb4d5148776a40",
      "checkDigest": "73fb6c65bb82cb5b4ec1a4289bf3c01c9dcf07db8b3e57161bf10b4d15f6640e",
      "outcome": "pass",
      "detail": "exit 0"
    },
    {
      "key": "command:aed9b13d-bbde-8d48-8e4b-e02a3ad64a11",
      "runId": "05e8a3a2-fb19-4c05-a6d2-607f8377c9fe",
      "sourceDigest": "5159553a93564fdf32dd6f9559cb37eea28cba17d5fd53e66bdb4d5148776a40",
      "checkDigest": "ddbcfdc1e44e84f08e5ec043570bf327f8cb6e2444fabe7813f1249f5610c5a4",
      "outcome": "pass",
      "detail": "exit 0"
    },
    {
      "key": "command:835c6845-b9f1-8359-b222-271c56dbad45",
      "runId": "05e8a3a2-fb19-4c05-a6d2-607f8377c9fe",
      "sourceDigest": "5159553a93564fdf32dd6f9559cb37eea28cba17d5fd53e66bdb4d5148776a40",
      "checkDigest": "82f03d90770a9d4e940d08884cdb50fdfc3c1c758a12b9a61e80b5411476c898",
      "outcome": "pass",
      "detail": "exit 0"
    },
    {
      "key": "command:e49ce4da-8d40-855e-9c96-2f6723794a23",
      "runId": "05e8a3a2-fb19-4c05-a6d2-607f8377c9fe",
      "sourceDigest": "5159553a93564fdf32dd6f9559cb37eea28cba17d5fd53e66bdb4d5148776a40",
      "checkDigest": "d534b3fe183a439555610f59e2b65941565814130c5b576a6649128643d4437e",
      "outcome": "pass",
      "detail": "exit 0"
    },
    {
      "key": "command:8a0f4b13-b869-8d0e-bbd0-59000d824efe",
      "runId": "05e8a3a2-fb19-4c05-a6d2-607f8377c9fe",
      "sourceDigest": "5159553a93564fdf32dd6f9559cb37eea28cba17d5fd53e66bdb4d5148776a40",
      "checkDigest": "6291872c01537fc319c93051c83950ba21b9c7fb7fc34905bd299a8230c70c2a",
      "outcome": "pass",
      "detail": "exit 0"
    },
    {
      "key": "command:7f011d7f-e2d9-8ea9-99ae-7450d7879e2e",
      "runId": "05e8a3a2-fb19-4c05-a6d2-607f8377c9fe",
      "sourceDigest": "5159553a93564fdf32dd6f9559cb37eea28cba17d5fd53e66bdb4d5148776a40",
      "checkDigest": "3d375bc7af734ec5f605081dc645324ebaf0730dd496f58c0a7823964e7c1bac",
      "outcome": "pass",
      "detail": "exit 0"
    },
    {
      "key": "command:537947a3-37ec-86ab-9f87-ac54e50d1796",
      "runId": "05e8a3a2-fb19-4c05-a6d2-607f8377c9fe",
      "sourceDigest": "5159553a93564fdf32dd6f9559cb37eea28cba17d5fd53e66bdb4d5148776a40",
      "checkDigest": "bfd33bffa573b64eebde85bffb7747fc68f71e0c5b6f33667297c65496aa29a3",
      "outcome": "pass",
      "detail": "exit 0"
    },
    {
      "key": "command:82c028b6-b26e-82af-bb28-80b57bda6576",
      "runId": "05e8a3a2-fb19-4c05-a6d2-607f8377c9fe",
      "sourceDigest": "5159553a93564fdf32dd6f9559cb37eea28cba17d5fd53e66bdb4d5148776a40",
      "checkDigest": "367dd345ae37a4ec3640ff16369b7c4f003b2309ac9612f87b35ba263ae072ff",
      "outcome": "pass",
      "detail": "exit 0"
    },
    {
      "key": "command:5e20c4c0-c26d-8662-93b0-59575a838f83",
      "runId": "05e8a3a2-fb19-4c05-a6d2-607f8377c9fe",
      "sourceDigest": "5159553a93564fdf32dd6f9559cb37eea28cba17d5fd53e66bdb4d5148776a40",
      "checkDigest": "ac83c2066741284286f407c449de7dd281bdeaca837779a522674b68438a9649",
      "outcome": "pass",
      "detail": "exit 0"
    },
    {
      "key": "command:dea7dcb9-9337-8e8a-9d0d-db2816e25612",
      "runId": "05e8a3a2-fb19-4c05-a6d2-607f8377c9fe",
      "sourceDigest": "5159553a93564fdf32dd6f9559cb37eea28cba17d5fd53e66bdb4d5148776a40",
      "checkDigest": "fb77363796702ac58c9c8af15fca5958b611bae5b1932ce67f9da51b4e700e03",
      "outcome": "pass",
      "detail": "exit 0"
    },
    {
      "key": "command:823982ba-7fa8-8c9d-9721-f2b128d0db00",
      "runId": "05e8a3a2-fb19-4c05-a6d2-607f8377c9fe",
      "sourceDigest": "5159553a93564fdf32dd6f9559cb37eea28cba17d5fd53e66bdb4d5148776a40",
      "checkDigest": "535b8800284fabc3cd4c8337819ea98138dc57a75cb5da97ff4f350e3a7349c2",
      "outcome": "pass",
      "detail": "exit 0"
    }
  ]
}
