{
  "schemaVersion": 1,
  "producedAt": "2026-09-06T06:26:59.780Z",
  "producer": {
    "name": "spec-ledger check",
    "version": "0.1.0"
  },
  "rows": [
    {
      "key": "command:b-sl-024",
      "runId": "244bd105-1d5c-4110-bf68-9af52d701832",
      "sourceDigest": "c8f4868ff34987197994875b18ee719a82f3fb07a5e32fe907182a2ef6f6b448",
      "checkDigest": "cb4a09a190aab1fcc774404ecb29ae1571c354704446d4def02534893147ed1a",
      "outcome": "pass",
      "detail": "exit 0",
      "durationMs": 8616,
      "artifacts": [
        {
          "path": ".spec-ledger/evidence/check-runs/244bd105-1d5c-4110-bf68-9af52d701832-stdout.txt",
          "sha256": "27210c2d008634385c1f42d8fec20e1add03d4af2cb6a6e8c8514afd32522862",
          "required": true
        },
        {
          "path": ".spec-ledger/evidence/check-runs/244bd105-1d5c-4110-bf68-9af52d701832-stderr.txt",
          "sha256": "e3b0c44298fc1c149afbf4c8996fb92427ae41e4649b934ca495991b7852b855",
          "required": true
        }
      ]
    }
  ]
}
