{
  "schemaVersion": 1,
  "producedAt": "2026-09-05T03:47:16.184Z",
  "producer": {
    "name": "spec-ledger check",
    "version": "0.1.0"
  },
  "rows": [
    {
      "key": "command:37455091-6c3b-827f-8ed3-f4737345e01c",
      "runId": "1209c5ba-b338-43b2-9741-9e05f69eb9d3",
      "sourceDigest": "588ab03a70a938a8c3cc2349b1fec23ad81747fa30173beaea67b57fa0c09e49",
      "checkDigest": "5f8772b9bb1e794e4186f9b6370beda122a92227c9491d56efa0b010f8f31beb",
      "outcome": "pass",
      "detail": "exit 0",
      "durationMs": 403,
      "artifacts": [
        {
          "path": ".spec-ledger/evidence/check-runs/1209c5ba-b338-43b2-9741-9e05f69eb9d3-stdout.txt",
          "sha256": "02eb6b29c58558b7ad88d87979e57f538b5d80cd2540a6dd21f7a54301f5678f",
          "required": true
        },
        {
          "path": ".spec-ledger/evidence/check-runs/1209c5ba-b338-43b2-9741-9e05f69eb9d3-stderr.txt",
          "sha256": "e3b0c44298fc1c149afbf4c8996fb92427ae41e4649b934ca495991b7852b855",
          "required": true
        }
      ]
    }
  ]
}
