{
  "schemaVersion": 1,
  "producedAt": "2026-09-06T21:10:23.913Z",
  "producer": {
    "name": "spec-ledger check",
    "version": "0.1.0"
  },
  "rows": [
    {
      "key": "command:b9215e80-1cbf-8bbf-83dc-63ceab15c182",
      "runId": "dc195b55-55b8-44b2-b960-86ca76ea0aa9",
      "sourceDigest": "b860fecaf0f21d922057b248c6d86cf680df6dfc52020ef2f5047de2fbe1f450",
      "checkDigest": "1fc9f3c4b4c94dfd0b6a2baba3030dca683f007b564258cad315673776292b8a",
      "outcome": "pass",
      "detail": "exit 0",
      "durationMs": 256,
      "artifacts": [
        {
          "path": ".spec-ledger/evidence/check-runs/dc195b55-55b8-44b2-b960-86ca76ea0aa9-stdout.txt",
          "sha256": "42db6b179ef38c9ca862af4ac59bad161bdb38a1f3aa9258d01c404229247318",
          "required": true
        },
        {
          "path": ".spec-ledger/evidence/check-runs/dc195b55-55b8-44b2-b960-86ca76ea0aa9-stderr.txt",
          "sha256": "e3b0c44298fc1c149afbf4c8996fb92427ae41e4649b934ca495991b7852b855",
          "required": true
        }
      ]
    }
  ]
}
