{
  "schemaVersion": 1,
  "producedAt": "2026-09-06T20:39:26.074Z",
  "producer": {
    "name": "spec-ledger check",
    "version": "0.1.0"
  },
  "rows": [
    {
      "key": "command:835c6845-b9f1-8359-b222-271c56dbad45",
      "runId": "d8e0777b-6a47-482c-84f7-6b657d2da442",
      "sourceDigest": "9cb69fbe142bdc23c828db8c97033f676cb8135735bc1b2fe4d4e01ac0812e05",
      "checkDigest": "13fbc79fe69442007461fbb681719a7dae7423a9e62a19521afa8407b8508665",
      "outcome": "pass",
      "detail": "exit 0",
      "durationMs": 98,
      "artifacts": [
        {
          "path": ".spec-ledger/evidence/check-runs/d8e0777b-6a47-482c-84f7-6b657d2da442-stdout.txt",
          "sha256": "2571ab22acc2f4c1af4b8d0723cefac6c7cfa67f8d4165f6b07abf99eaed5090",
          "required": true
        },
        {
          "path": ".spec-ledger/evidence/check-runs/d8e0777b-6a47-482c-84f7-6b657d2da442-stderr.txt",
          "sha256": "e3b0c44298fc1c149afbf4c8996fb92427ae41e4649b934ca495991b7852b855",
          "required": true
        }
      ]
    }
  ]
}
